{
  "schemaVersion": 1,
  "node": "Golden",
  "createdUtc": "2026-10-24T13:45:09.619812Z",
  "trainingGames": 32,
  "examples": {
    "training": 1600,
    "validation": 400
  },
  "negativeLogLikelihood": {
    "training": 0.9596356625364884,
    "validation": 0.9748596222584748
  },
  "optimiser": {
    "name": "lbfgs",
    "iterations": 20
  }
}
